surface,status,input_values,output_values,clock_basis,model_use,held_out_reason,blocked_by
public_reporting_trajectory,updated,"{""active_suspected_total"": null, ""confirmed"": 975, ""deaths_confirmed"": 249, ""deaths_suspected"": null, ""suspected_in_isolation"": 213, ""suspected_under_investigation"": null}",{},"SitRep #036 (975 confirmed, data as of 2026-06-19) is the confirmed-case headline. Confirmed-death endpoint is SitRep #036 (249, data as of 2026-06-19) is the laboratory-confirmed death headline. Suspected-death and under-investigation stocks remain absent unless the current reviewed SitRep explicitly republishes them.",current_model_or_display_input,,
visibility_module_c,updated,"{""confirmed"": 975}","{""confirmation_backlog_50"": [0, 0], ""reporting_completeness_50"": [0.49448581599146574, 0.5738687903859934]}","Snapshot-level visibility nowcast. Reporting completeness is delay-only (the gamma reporting-delay CDF); the suspect-queue positivity term carries zero weight (DATA_TERM_WEIGHT = 0.0), so it does not drive the completeness posterior. The cumulative suspected tier was retired 2026-06-02, so no cumulative suspected denominator feeds this surface.",current_model_or_display_input,,
confirmable_underlying_trajectory,retired_c1_regime,"{""confirmed_endpoint"": 975, ""reporting_completeness_50"": [0.49448581599146574, 0.5738687903859934]}",{},"C1 confirmable total retired under the C2 active-queue regime (2026-05-29 onward); the reporting-completeness fraction is kept as an input-only reference, not a current model output.",retired_not_a_current_model_input,"C1 confirmable total (confirmed / reporting-completeness) is retired under the C2 active-queue regime; the completeness fraction is kept as an input-only reference, not a current model output.",
death_back_projection_and_grid,updated_snapshot_level,"{""deaths_confirmed"": 249, ""deaths_suspected"": null}",{},"Confirmed-death endpoint is SitRep #036 (249, data as of 2026-06-19) feeds the confirmed-only death-back-projection grid. The broader suspected-death register is not carried onto the current-cycle surface after the confirmed/suspected death-axis split unless a reviewed source republishes it.",current_snapshot_level_model_input,,
transmission_depth,updated,"{""confirmed"": 975}",{},Transmission plausibility uses the current reconciled confirmed headline count.,current_model_or_display_input,,
corridor_watchlist,source_attribution_lag,"{""headline_confirmed"": 975, ""source_zone_count"": 34, ""source_zones_with_confirmed"": 34, ""unallocated_headline_confirmed"": 36, ""zone_attributed_confirmed"": 939}",{},"Per-health-zone confirmed attribution uses the reviewed INSP SitRep Table 1 (inrb-sitrep-036-2026-06-19): 34 source zones, of which 34 carry confirmed cases, attributing 939 confirmed. The remaining 36 confirmed are the unallocated headline + cross-border attribution lag, held in the residual pending a coordinated zone-alias bridge and map-geometry expansion rather than smeared across source zones.",headline_context_only_for_spatial_attribution,Latest headline aggregate is not allocated into zone-attributed model rows until a reviewed cumulative health-zone table is available.,"Per-health-zone confirmed attribution uses the reviewed INSP SitRep Table 1 (inrb-sitrep-036-2026-06-19): 34 source zones, of which 34 carry confirmed cases, attributing 939 confirmed. The remaining 36 confirmed are the unallocated headline + cross-border attribution lag, held in the residual pending a coordinated zone-alias bridge and map-geometry expansion rather than smeared across source zones."
active_queue_projection_c2,updated,"{""active_suspected_total"": 213, ""confirmed_active_total"": 975, ""lab_samples_analyzed_recent"": 116, ""lab_samples_positive_recent"": 23, ""lab_window"": ""2026-06-19/2026-06-19""}","{""confirmable_active_queue_50"": [1013, 1023], ""expected_active_queue_confirmations_50"": [38, 48], ""recent_lab_positivity_50"": [0.1775, 0.2274]}","Module C2 active-queue lab-yield: a SIBLING diagnostic to the Module C (C1) reporting-completeness nowcast, never an input to it. Recent reviewed-SitRep lab positivity (flat Beta(1,1)) applied to the operational active-suspected queue (cases under investigation plus cases in isolation), added to confirmed. A known-queue yield within the response system, not reporting completeness, hidden community incidence, deaths, or future spread.",current_model_or_display_input,,
