surface,status,input_values,output_values,clock_basis,model_use,held_out_reason,blocked_by
public_reporting_trajectory,updated,"{""confirmed"": 128, ""deaths"": 247, ""suspected"": 1077}",{},"ECDC 27 May confirmed/suspected counts carry a May 26 data/report date (attributed to DRC MoH on 26 May); INRB build-2026-05-28 cross-corroborates DRC-only cases and supplies the higher DRC suspected-death primary on the same data date. Deaths are composed as 247 = 246 DRC suspected deaths (INRB/INSP) + 1 Uganda confirmed death (ECDC/CDC), so the chart uses the May 26 data date while disclosing mixed status classes.",current_model_or_display_input,,
visibility_module_c,updated,"{""confirmed"": 128, ""suspected"": 1077}","{""confirmation_backlog_50"": [503, 847], ""reporting_completeness_50"": [0.3987326460797613, 0.46123674694904326]}",Snapshot-level visibility nowcast; prior-weighted with a Beta-Binomial update from the current confirmed/suspected headline pair.,current_model_or_display_input,,
confirmable_underlying_trajectory,updated,"{""confirmed_endpoint"": 128, ""reporting_completeness_50"": [0.3987326460797613, 0.46123674694904326]}","{""endpoint_confirmable_50"": [278, 321]}",Confirmed endpoint is dated May 26 (DRC MoH per ECDC + INRB); the completeness posterior is the current snapshot posterior applied across the displayed confirmed-case series.,current_model_or_display_input,,
death_back_projection_and_grid,updated_snapshot_level,"{""deaths"": 247}",{},"The 247-death input is the disclosed May 26 composition: 246 DRC suspected deaths from INRB/INSP/UMIE plus one Uganda confirmed death from ECDC/CDC. It updates the snapshot-level sensitivity calculation as a connected dated trajectory point. ECDC's lower 238 DRC suspected deaths, CDC 25 May (223), the DRC MoH dashboard aggregate (179, 24 May), and the earlier ECDC 25 May figure (119) are held as conflict anchors.",current_snapshot_level_model_input,,
transmission_depth,updated,"{""confirmed"": 128}",{},Transmission plausibility uses the current reconciled confirmed headline count.,current_model_or_display_input,,
corridor_watchlist,source_attribution_lag,"{""headline_confirmed"": 128, ""unallocated_headline_confirmed"": 19, ""zone_attributed_confirmed"": 109}",{},No reviewed May 26 cumulative health-zone table. The DRC MoH SitRep 009 dashboard rows and the INRB build-2026-05-28 bb8b7d5 processed health-zone layers (latest at 2026-05-26) remain source-review until their cumulative-table semantics and source labels are reviewed against original MoH/INSP publication context.,headline_context_only_for_spatial_attribution,Latest headline aggregate is not allocated into zone-attributed model rows until a reviewed cumulative health-zone table is available.,No reviewed May 26 cumulative health-zone table. The DRC MoH SitRep 009 dashboard rows and the INRB build-2026-05-28 bb8b7d5 processed health-zone layers (latest at 2026-05-26) remain source-review until their cumulative-table semantics and source labels are reviewed against original MoH/INSP publication context.
